{
  "schema_version": "0.1.0",
  "session_id": "seed-b-dependency-web",
  "kind": "mixed",
  "isolated_unit": null,
  "meta": {
    "name": "Seed B — The dependency web (state flows between tasks)",
    "tier": "M",
    "seed": 202,
    "mixture": { "K": 6, "H": 0.55, "D": 0.5, "DEP": 0.6, "IR": 0.3, "NV": 0.0 }
  },
  "world": {
    "dsv": {
      "kind": "dsv",
      "state": {
        "docs": {
          "supply-chains.md": "notes on smart-home sensor supply chains:\n- 2025 global size ~ 18B USD\n- CAGR ~ 12%\n- top region: North America\n- key constraint: regulation lag for imports",
          "context.md": "client asks: quantify market, name top region, give one risk.\n- risk: regulation lag\n- target: chilled, factual memo"
        },
        "market": { "SEN": { "price": 12.4, "note": "sensor maker" }, "LUM": { "price": 54.0, "note": "lighting group" } },
        "tables": {
          "inventory": {
            "cols": ["id", "qty", "price", "unit", "currency"],
            "rows": [
              ["item0", "100", "3.50", "kg", "USD"],
              ["item1", "110", "3.80", "kg", "USD"],
              ["item2", "120", "4.00", "kg", "USD"],
              ["item3", "130", "4.20", "kg", "USD"],
              ["item4", "140", "4.50", "lb", "USD"],
              ["item1b", "110", "3.80", "kg", "USD"]
            ]
          }
        }
      }
    },
    "calendar": {
      "kind": "calendar",
      "state": {
        "owner": "me",
        "events": [
          { "start": "09:00", "end": "09:45", "title": "Standup" },
          { "start": "14:00", "end": "15:00", "title": "Client review" }
        ]
      }
    },
    "email": { "kind": "email", "state": { "sent": [], "inbox": [] } },
    "fs": { "kind": "fs", "state": { "files": {} } }
  },
  "units": [
    {
      "id": "t01_munging_inventory",
      "family": "data_munging",
      "title": "Clean the inventory CSV",
      "brief": "The inventory table has unit drift (one row in lb) and a near-duplicate id. Write data/cleaned_inventory.csv with the same columns, only rows in kg/USD, duplicate id resolved by summing quantities, and qty rounded to integers. The file should have 4 data rows exactly.",
      "background": "Finance needs this for the budget model; they will read the file directly.",
      "tools": ["dsv", "fs"],
      "verifier": {
        "type": "composite",
        "config": {
          "children": [
            { "type": "csv_rows_match", "config": { "path": "fs/data/cleaned_inventory.csv", "must_include_rows": [{ "id": "item0" }], "total_rows_expected": 4 } },
            { "type": "numeric_assert", "config": { "path": "fs/data/cleaned_inventory.csv", "rows": [{ "col": "qty", "op": "gt", "value": 0 }] } }
          ]
        }
      },
      "checkpoints": [
        { "type": "file_created", "config": { "path": "fs/data/cleaned_inventory.csv" }, "id": "cp_csv_created" }
      ],
      "priority": 3,
      "time_budget_min": 20,
      "rarity": 1,
      "interruptible": true,
      "produce_artifacts": ["fs/data/cleaned_inventory.csv"]
    },
    {
      "id": "t02_research_supply",
      "family": "research_memo",
      "title": "Research memo: smart-home sensor supply chains",
      "brief": "Write a short research memo on smart-home sensor supply chains. Read the docs in the data source, then write reports/memo_supply.md covering: (1) market size and CAGR, (2) the top region, (3) one key risk, (4) the current quote of ticker SEN.",
      "background": "The client needs this before the 11:00 review meeting.",
      "tools": ["dsv", "fs"],
      "verifier": {
        "type": "composite",
        "config": {
          "children": [
            { "type": "file_created", "config": { "path": "fs/reports/memo_supply.md" } },
            { "type": "file_contains", "config": { "path": "fs/reports/memo_supply.md", "patterns": ["CAGR", "18", "North America", "regulation", "SEN"] } }
          ]
        }
      },
      "checkpoints": [
        { "type": "file_created", "config": { "path": "fs/reports/memo_supply.md" }, "id": "cp_memo_created" }
      ],
      "priority": 4,
      "time_budget_min": 25,
      "rarity": 1,
      "interruptible": true,
      "produce_artifacts": ["fs/reports/memo_supply.md"]
    },
    {
      "id": "t03_comms_update",
      "family": "comms",
      "title": "Email Priya with the cleaned file",
      "brief": "Send an email to priya@corp.example updating them on the inventory file. First read data/cleaned_inventory.csv from the workspace to confirm the final row count, then send an email with subject containing 'update', a one-paragraph body mentioning the deliverable, attaching cleaned_inventory.csv, professional tone, under 120 words.",
      "background": "Finance is waiting on the clean file.",
      "tools": ["email", "fs"],
      "depends_on": [{ "unit": "t01_munging_inventory", "artifact": "fs/data/cleaned_inventory.csv" }],
      "verifier": {
        "type": "email_checks",
        "config": { "requires": [{ "to": "priya@corp.example", "subject_sub": "update", "body_sub": "deliverable", "attach_sub": "cleaned_inventory.csv" }] }
      },
      "checkpoints": [],
      "priority": 2,
      "time_budget_min": 10,
      "rarity": 1,
      "interruptible": true,
      "produce_artifacts": ["email/sent"]
    },
    {
      "id": "t04_travel_itinerary",
      "family": "travel_plan",
      "title": "Build the Suzhou itinerary",
      "brief": "Plan a one-day business itinerary for Suzhou: first read reports/memo_supply.md from the workspace, then write travel/itinerary.txt containing a day plan starting with 'Morning', including 'convention center visit' and 'factory tour' in that order, a 'Budget' line whose total $ amount does not exceed 1800, and mention the hotel district (any choice).",
      "background": "The ops team executes whatever is in the file, verbatim.",
      "tools": ["fs"],
      "depends_on": [{ "unit": "t02_research_supply", "artifact": "fs/reports/memo_supply.md" }],
      "verifier": {
        "type": "constraint_solver",
        "config": { "path": "fs/travel/itinerary.txt", "must_include": ["Suzhou", "Morning", "Budget"], "order": ["convention center visit", "factory tour"], "budget_cap": 1800 }
      },
      "checkpoints": [
        { "type": "file_created", "config": { "path": "fs/travel/itinerary.txt" }, "id": "cp_travel" }
      ],
      "priority": 3,
      "time_budget_min": 15,
      "rarity": 2,
      "interruptible": true,
      "produce_artifacts": ["fs/travel/itinerary.txt"]
    },
    {
      "id": "t05_brief_launch",
      "family": "creative_brief",
      "title": "Write the launch brief",
      "brief": "Write a one-page launch brief for calm-focus desk lamps, grounded in the research memo you wrote (read reports/memo_supply.md first). Save it to briefs/launch_brief.txt. It must contain a headline, a 'Target audience' section, a 'Messaging' section and 3 bullet points. At least 80 words. No placeholder text like 'TODO' or 'TBD'.",
      "background": "The designer needs this by EOD; quality matters more than length.",
      "tools": ["fs"],
      "depends_on": [{ "unit": "t02_research_supply", "artifact": "fs/reports/memo_supply.md" }],
      "verifier": {
        "type": "keyword_structure",
        "config": { "path": "fs/briefs/launch_brief.txt", "must_include": ["headline", "Target audience", "Messaging"], "must_not_include": ["TODO", "TBD"], "min_words": 80, "structure_order": ["Target audience", "Messaging"] }
      },
      "checkpoints": [],
      "priority": 2,
      "time_budget_min": 20,
      "rarity": 3,
      "interruptible": true,
      "produce_artifacts": ["fs/briefs/launch_brief.txt"]
    },
    {
      "id": "t06_math_profit",
      "family": "math_word",
      "title": "Pricing math",
      "brief": "Each unit sells at 120 CNY net; we ship 5 units per day; fixed overhead is 4 x 10 CNY per day. Reply with the daily net profit as a single number (do the arithmetic, answer in your final reply as 'Answer: <number>').",
      "background": "",
      "tools": [],
      "verifier": {
        "type": "numeric_assert",
        "config": { "source": "reply", "rows": [{ "op": "eq", "value": 560, "tol": 0.5 }] }
      },
      "checkpoints": [],
      "priority": 1,
      "time_budget_min": 4,
      "rarity": 1,
      "interruptible": true
    }
  ],
  "events": [
    { "id": "e0", "kind": "assign", "at": "09:05", "unit": "t01_munging_inventory", "payload": { "user": "The inventory table has unit drift (one row in lb) and a near-duplicate id. Write data/cleaned_inventory.csv with the same columns, only rows in kg/USD, duplicate id resolved by summing quantities, and qty rounded to integers. The file should have 4 data rows exactly.", "background": "Finance needs this for the budget model; they will read the file directly." } },
    { "id": "e1", "kind": "interrupt", "at": "09:12", "unit": "t01_munging_inventory", "payload": { "reason": "standup ran long — sorry, continue" } },
    { "id": "e2", "kind": "resume", "at": "09:16", "unit": "t01_munging_inventory", "payload": { "note": "continue where you left off" } },
    { "id": "e3", "kind": "assign", "at": "09:30", "unit": "t02_research_supply", "payload": { "user": "Write a short research memo on smart-home sensor supply chains. Read the docs in the data source, then write reports/memo_supply.md covering: (1) market size and CAGR, (2) the top region, (3) one key risk, (4) the current quote of ticker SEN.", "background": "The client needs this before the 11:00 review meeting." } },